{
  "tool": "not-recorded",
  "toolVersion": "not-recorded",
  "provider": "not-recorded",
  "model": "not-recorded",
  "effort": "not-exposed",
  "operatingSystem": "not-recorded",
  "startedAt": "2026-09-21T12:11:16Z",
  "finishedAt": "2026-09-21T16:29:18Z",
  "branch": "main",
  "initialCommit": "98a9f4ca83d538e9610844086ca74b7ff32492e1",
  "finalCommit": "refs/tags/iacode-checkpoints/SETUP-00-CP-0012"
}
