{
  "tool": "Codex desktop",
  "toolVersion": "not-exposed",
  "provider": "OpenAI",
  "model": "not-exposed",
  "effort": "not-exposed",
  "operatingSystem": "Windows",
  "startedAt": "2026-10-16T14:27:16Z",
  "finishedAt": "2026-10-17T07:40:20Z",
  "branch": "main",
  "initialCommit": "44f6da5b092b5f3243331253ca4fc2bf7c45d603",
  "finalCommit": "refs/tags/iacode-checkpoints/GATE-5-CP-0001"
}
