{
  "tool": "Claude Code 2.1.195, desktop application",
  "toolVersion": "2.1.195",
  "provider": "Anthropic",
  "model": "claude-opus-5",
  "effort": "not-exposed",
  "operatingSystem": "Windows 11 Pro 10.0.26200",
  "startedAt": "2026-09-21T05:56:53Z",
  "finishedAt": "2026-09-21T08:22:19Z",
  "branch": "main",
  "initialCommit": "90b67a7e0a11179465bc5c92dee22c78da36801f",
  "finalCommit": "refs/tags/iacode-checkpoints/SETUP-00-CP-0011"
}
