{
  "tool": "not-recorded",
  "toolVersion": "not-recorded",
  "provider": "not-recorded",
  "model": "not-recorded",
  "effort": "not-exposed",
  "operatingSystem": "not-recorded",
  "startedAt": "2026-09-22T22:50:36Z",
  "finishedAt": "2026-09-23T01:52:16Z",
  "branch": "main",
  "initialCommit": "d4a3998ce745dcbfcf6a8498f267ee302834543f",
  "finalCommit": "HEAD"
}
